{
  "album": "Fabricated Example",
  "primary_credit": "Example Artist",
  "idiom": "rock",
  "release_form": "lp",
  "language": "zh",
  "evidence": [
    {"source_id": "mb", "type": "metadata_db", "orientation": "community-curated", "reliability": 2, "freshness": "2026-01"}
  ],
  "claims": [
    {"text": "录音于 1972 年在 Abbey Road 完成。", "kind": "fact", "fact_class": "recording_date", "source_ids": ["ghost_source"], "confidence": 0.8}
  ],
  "gaps": [],
  "trace": {"skill_version": "0.1.0", "loaded_source_ids": ["mb"], "research_mode": "online"}
}
